Question,Answer,Context
What is the capital of France?,Paris is the capital of France.,"Paris is the capital and most populous city of France. It has been one of Europe's major centres of finance, diplomacy, commerce, culture, fashion, and gastronomy."
When was the Eiffel Tower built?,The Eiffel Tower was built in 1889.,"The Eiffel Tower is a wrought-iron lattice tower on the Champ de Mars in Paris. It was constructed from 1887 to 1889 as the centerpiece of the 1889 World's Fair."
What is photosynthesis?,Photosynthesis is the process by which plants convert sunlight into energy.,"Photosynthesis is a biological process used by many cellular organisms to convert light energy into chemical energy, which is stored in organic compounds that can later be metabolized."
Who wrote Romeo and Juliet?,William Shakespeare wrote Romeo and Juliet.,"Romeo and Juliet is a tragedy written by William Shakespeare early in his career about the romance between two Italian youths from feuding families."
What is the speed of light?,The speed of light is approximately 299792458 meters per second.,"The speed of light in vacuum, commonly denoted c, is a universal physical constant that is exactly equal to 299,792,458 metres per second."
